{
  "schema_version": "1.0",
  "generated_at_utc": "2026-03-29T07:31:30.329807+00:00",
  "cycle_id": "2026-03-29T07:31:28.739036+00:00",
  "completed_steps": [
    "exec_memory",
    "advisory",
    "loop_summary"
  ],
  "last_completed_step": "loop_summary",
  "exec_memory_cycle_ready": true,
  "partial": false
}
